{
  "contract_version": "memory-p3-retrieval-v1",
  "project_id": "22222222-2222-4222-8222-222222222222",
  "current_session_id": "33333333-3333-4333-8333-333333333333",
  "active_thread_id": "55555555-5555-4555-8555-555555555555",
  "active_thread_revision": 3,
  "current_working_signals": [
    {
      "signal_id": "working-signal-1",
      "working_memory_id": "working-1",
      "thread_id": "55555555-5555-4555-8555-555555555555",
      "revision": 1,
      "semantic_kind": "episode",
      "semantic_status": "current",
      "query_text": "bounded semantic signal"
    }
  ],
  "recent_eligible_transcript_signals": [
    {
      "segment_id": "77777777-7777-4777-8777-777777777777",
      "session_id": "33333333-3333-4333-8333-333333333333",
      "text_revision": 1,
      "speaker_role_revision": 1,
      "effective_text_digest": "aaaaaaaaaaaaaaaaaaaaaaaaaaaaaaaaaaaaaaaaaaaaaaaaaaaaaaaaaaaaaaaa",
      "eligibility": "trusted-elder-final-conversation",
      "bounded_query_text": "bounded transcript query signal"
    }
  ],
  "query_vector": [0.1, 0.2],
  "configuration": {
    "embedding_threshold": 0.7,
    "candidate_limit": 8,
    "graph_depth": 1,
    "graph_limit": 4
  },
  "storage": { "kind": "postgresql-pgvector-v1" },
  "embedding": {
    "port": "provider-neutral",
    "model_status": "deferred",
    "dimensions": 2
  },
  "candidates": [
    {
      "memory_id": "44444444-4444-4444-8444-444444444444",
      "resolution_authority_id": "66666666-6666-4666-8666-666666666666",
      "revision_id": "88888888-8888-4888-8888-888888888888",
      "revision_no": 1,
      "source_level": "mid",
      "semantic_kind": "episode",
      "semantic_status": "current",
      "safe_content": "safe semantic content",
      "retrieval_sources": ["embedding", "graph"],
      "embedding_score": 0.9,
      "graph_distance": 1,
      "rank": 0
    }
  ],
  "graph_edges": [
    {
      "relation": "RELATED",
      "from": {
        "layer_identity_id": "44444444-4444-4444-8444-444444444444",
        "project_id": "22222222-2222-4222-8222-222222222222",
        "origin_session_id": "33333333-3333-4333-8333-333333333333",
        "origin_thread_id": "55555555-5555-4555-8555-555555555555",
        "origin_resolution_authority_id": "66666666-6666-4666-8666-666666666666"
      },
      "to": {
        "layer_identity_id": "99999999-9999-4999-8999-999999999999",
        "project_id": "22222222-2222-4222-8222-222222222222",
        "origin_session_id": "33333333-3333-4333-8333-333333333333",
        "origin_thread_id": "55555555-5555-4555-8555-555555555555",
        "origin_resolution_authority_id": "66666666-6666-4666-8666-666666666666"
      }
    }
  ]
}
